<?xml version="1.0" encoding="UTF-8"?>
<libreria xmlns:xsi="http://www.w3.org/2001/XMLSchema-instance" 
            xsi:noNamespaceSchemaLocation="libreria.xsd">

    <libro>
        <titulo>El Señor de los Anillos</titulo>
        <autor>J.R.R. Tolkien</autor>
        <anio>1954</anio>
        <genero>Fantasía</genero>
    </libro>

    <libro>
        <titulo>Dune</titulo>
        <autor>Frank Herbert</autor>
        <anio>1965</anio>
        <genero>Ciencia Ficción</genero>
    </libro>

    <libro>
        <titulo>Drácula</titulo>
        <autor>Bram Stoker</autor>
        <anio>1897</anio>
        <genero>Terror</genero>
    </libro>

    <libro>
        <titulo>Cien años de soledad</titulo>
        <autor>Gabriel García Márquez</autor>
        <anio>1967</anio>
        <genero>Drama</genero>
    </libro>

    <libro>
        <titulo>Fundación</titulo>
        <autor>Isaac Asimov</autor>
        <anio>1951</anio>
        <genero>Ciencia Ficción</genero>
    </libro>

    <libro>
        <titulo>El resplandor</titulo>
        <autor>Stephen King</autor>
        <anio>1977</anio>
        <genero>Terror</genero>
    </libro>

    <libro>
        <titulo>Los pilares de la Tierra</titulo>
        <autor>Ken Follett</autor>
        <anio>1989</anio>
        <genero>Histórica</genero>
    </libro>

    <libro>
        <titulo>Estudio en escarlata</titulo>
        <autor>Arthur Conan Doyle</autor>
        <anio>1887</anio>
        <genero>Policial</genero>
    </libro>

    <libro>
        <titulo>Harry Potter y la piedra filosofal</titulo>
        <autor>J.K. Rowling</autor>
        <anio>1997</anio>
        <genero>Fantasía</genero>
    </libro>

    <libro>
        <titulo>Crónica de una muerte anunciada</titulo>
        <autor>Gabriel García Márquez</autor>
        <anio>1981</anio>
        <genero>Policial</genero>
    </libro>

    <libro>
        <titulo>Neuromante</titulo>
        <autor>William Gibson</autor>
        <anio>1984</anio>
        <genero>Ciencia Ficción</genero>
    </libro>

    <libro>
        <titulo>El nombre de la rosa</titulo>
        <autor>Umberto Eco</autor>
        <anio>1980</anio>
        <genero>Histórica</genero>
    </libro>

    <libro>
        <titulo>It</titulo>
        <autor>Stephen King</autor>
        <anio>1986</anio>
        <genero>Terror</genero>
    </libro>

    <libro>
        <titulo>Hamlet</titulo>
        <autor>William Shakespeare</autor>
        <anio>1603</anio>
        <genero>Drama</genero>
    </libro>

</libreria>